0	1
最近寒いので、で計算負荷かけまくって熱くなったで暖とってる	0
について勉強してるなかなか大変ね	0
プロレスしている人を、プロレスできない人が一方的に批判する時代。批判された側はプロレスでうまく受け流す。批判した人はしてやったり。このままいくと本当につまらない時代になりそう。	0
竹原ピストルさんの、ふうせんガムが染みる	0
との説明は、これが一番分かりやすいのではと自画自賛してる	0
上級解析士の資格持ってても、 アナリティクスのセグメントの使い方ろくに分かっていない人を何人か見てきている。なのでその資格を持っているだけでは全然信用できない。	0
スープ作ってたけど、のタイマー機能に安心してちょっと目離した隙に盛大に煮こぼれして、床がベトベトに･･･。酒飲むつもり無かったけど、このショックは飲むしかない。	0
勉強して記事にしよう	0
チャドマレーンさんの、「世にも奇妙なニッポンのお笑い」読んだ全くもってオワコンじゃないよね	0
そろそろ仕事納めたい	0
竹原ピストルきたーー	0
昼から酒を飲んだっていいじゃない年末だもの	0
今年の紅白、野呂佳代さんはいつ出ますか	0
シェルプログラミングを勉強している	0
年末年始でブログのデザイン変更する	0
ビトたけしさんの浅草キッドに泣きそうになってしまった笑名曲だ	0
ラーメンズね	0
ギリギリギリギリジンジン～ギリギリギリジンジンジン～	0
仕事納めった温泉いって酒飲んでドキュメンタル観て、ちょっと遅めに寝る	0
確定申告とか住民税とか、給与じゃなくて報酬の場合とか･･･こんなに頭良い自分がよく分かっていないということは、制度が悪いか説明が悪いんだということにしてストレスを緩和している	0
チャリティーミュージックソン全部聴き終わった	0
今月突破だーー。やったーー	0
ニューヨーク面白い	0
ふぃーやり切ったぞ	0
はてなブログに投稿しました はてなブログ   を終えての所感  これで無理なら諦めて世界一やさしいデータ分析教室	0
ミュージックソンそろそろーたのしみー	0
の日目です 集として今までの記事をました。本日もよろしくどうそっす本ノックユーザーのための集  これで無理なら…	0
ドキュメンタルのダイアン西澤さんが面白すぎる	0
はてなブログに投稿しました はてなブログで高速化処理との実行速度を比較してみた。  これで無理なら諦めて世界一やさしいデータ分析教室	0
さて、朝ご飯と昼ご飯と軽食用おかしを買って家に日引きこもるぞやることいっぱい	0
も残りわずかですね…。今回はを使って作成したアプリケーションを公開する方法について。意外に簡単に公開することができました本日もよろしくどうぞですーー	0
を使った含む環境構築についてです本日もよろしくどうぞっす	0
円ってまじすか	0
力	0
スマホでラジオ聴く人のこと、スマラーっていうらしい私はスマラーです	0
はてなブログに投稿しました はてなブログ上で作ったファイルをダウンロード メソッドの使い方  これで無理なら諦めて世界一やさしいデータ分析教室	0
正規分布のことググるつもりで、間違って「正規表現」と検索しがち。	0
今週頑張れば今年終わったようなもん	0
自信作っす。皆さんに見てほしいっす。秒でも読んでくれたらうれしいっす。本日も、よろしくどうぞでございます。	0
	0
ダイアンの津田さんの に「歯が多い」って書いてあるの面白すぎる	0
眼鏡を探していて、分前に確実に探した場所から発見した。絶対に誰かが時間を止めてイタズラをしている。絶対に。	0
はてなブログに投稿しました はてなブログ【 】基本となるの関数を網羅的に理解する  これで無理なら諦めて世界一やさしいデータ分析教室	0
日目です。いいですねー。カッコイイ	0
ちゃんと学びたい	0
はてなブログに投稿しました はてなブログ【 】メソッドでファイルアップロード散布図プロット  これで無理なら諦めて世界一やさしいデータ分析教室	0
業務ハック行ってきた。いかに周りの人とイザコザ起こさず進めていくか、ってところが参考になった	0
に登録した課題をカンバン形式で表示したい親課題同士でカンバン表示。各親課題をクリックすると、それに紐付く子課題同士をカンバン表示。そういうの欲しい。えっ作ればいいってうーーん･･････そうですね、作りますか･･････	0
日目です。今回は前回書いたスプレッドシートの記事と似ていますが、ローカルで事前認証する方法について解説しています。ぜひ、用途に応じて使い分けてみてくださいー	0
日目を担当させていただきました でを使っての画像分類を行っています。本日もよろしくどうぞーーー	0
ヒートテック初めて履いたけど何この安心感	0
勉強中	0
日目です。今回はスプレッドシートを上で利用する方法について書きました本日もよろしくどうぞー	0
に気を取られてたけど、明日の 担当だったやべ	0
やったるここから日までは、私的やったるです。	0
毎年月はずっと眠い	0
ここ最近の松本人志さんのお笑い界を盛り上げようという感じに、本当に感動している	0
日目です記事投稿ありがとうございます。とても参考になります	0
久しぶりに自分の家以外でお酒を飲んだっす	0
日目です良質な記事ありがとうございます	0
土日ってブログのアクセス落ちるよね皆土日ってなにしてんの	0
で、「あ、今のもう一度聞きたい」ってなったときに、秒前とか分前とかに合わせるの大変すぎない	0
日目。昨日公開したドラッグドロップでデータ読み込むアプリケーションに、プロット機能を加えてみました。本日もよろしくどうぞー	0
溝の口、なんか治安悪くなってない笑	0
今更ですが、「  」から「   」に名前を変更。分かりやすくなった。	0
明日はこれにプラスして、プロットするところまでやってみます。そちらもよろしくどうぞー	0
あけて日金曜日。松本人志のドキュメンタル話目が公開されました。時を同じくして   日目の記事も公開です今回はドラッグドロップでアプリにデータを読み込ませる方法について。…	0
さむい	0
沈黙の金曜日聞いているこれまた面白い。あー困る。世の中には面白いラジオが多すぎる。時間が足りない。	0
日目がやってきました。今回は と使ったアプリケーション制作です。簡単に実装できるので興味ある方実践してみてくださいよろしくどうぞーーー	0
眠い。また明日お会いしましょう。	0
日目っす。今回は  の適用について。このライブラリ使うだけで、一気にそこそこかっこいいデザインのアプリケーションが作れます本日もよろしく…	0
の  日目です。 アナリティクスからデータを引っ張ってくる作成についてです。本日もよろしくどうぞー	0
本日二本目の更新   日目です。今回は、のをすっきりさせる、の使い方についてです。簡単に複数タブを持つページを作ることができます。よろしくどうぞー…	0
今日も今日とて 用に記事を公開していきます。今日はちなみに本更新予定まずは の   を使ってに …	0
日目です良記事ありがとうございます	0
マヂカルラブリー、来年ウォーリーネタで優勝してください	0
年の敗者復活からマヂカルラブリーがやっぱり好きだ。上沼恵美子さんに低評価の芸人が日の目を見る説あ、カミナリ以外事例無いのでマヂカルラブリー証明して笑	0
納得の優勝そしてマヂカルラブリーは準決勝でウケるネタ、つまりお笑い好きが一番好むネタだったまた単独いこうそして爆笑しよう最高だぜマヂカルラブリー	0
マヂカルラブリーはまだ時代が追いついてない来年優勝してくれ	0
これ関東の審査員の方々入って大正解ではないか･･･とても良いバランスな気がする	0
私の「グランプリ」三連単の順位予想は、位マヂカルラブリー、位とろサーモン、位敗者復活です。投票サイト   グランプリ  三連単	0
私禁酒中なのですが、体を温める目的で飲む熱燗はお酒のうちに入らないという認識でよろしいでしょうか	0
今日はです。そして の日目でもあります。でナビゲーションバーを作る方法について紹介しています。よろしくどうぞー	0
あとか、余裕かよ	0
日目に参加しました	0
気付けば月日になっていたようですということは…   日目更新です今回も基礎編で、・・画像の設定についてです。よろしくどうぞー	0
先日書いた・の記事を、株式会社キスモさんの技術ブログにて紹介していただきました。ありがとうございます	0
の 、日分入れたけど結構埋まってきたから日分外そうかな。記事はもう書いちゃったけど	0
久々の本ノック更新原点回帰で「とは」についてです。	0
のアドベントカレンダー、時期が微妙だったので後ろにずらした	0
なんと、気づけば明日から月かということはアドベントカレンダーが開催されるということか…	0
本当に勉強したいこと、やりたいことが多すぎる優先順位	0
ほう…全く中身は読んでいない	0
こうなったら埋めるしかない	0
日常が迫ってくる	0
読者増えた…嬉しいぞ	0
なるほど…に応用するために勉強	0
今週は祝日あるから週四勤務かストレス軽減度合いが半端ないっすね	0
機械学習のモデル評価指標のつである曲線、に関してました。今回も図や表、例を多く取り入れてますので、、よく分からなかったという方はぜひ一読してくださいませ。	0
あれはじパタどこいった引越しのときにどこしまったっけ	0
松本人志の放送室、またやらないかなー…って一日回ぐらい考えている	0
日目に参加しました	0
おー増えている	0
にてコマンドを打つと、画像で数式を表示してくれるを作成しましたで数式使ったコミュニケーションをしたい方は、ぜひ参考にしてみてください	0
初参加でよく分からないのだが、過去記事貼ってもいいの自分で作ったカレンダー埋まらなかったら過去記事貼ろうかな。	0
やらんとね	0
自分で書いたのコード汚すぎたから、リーダブルコード読むことにする	0
でで数式打つと、画像が生成されるツール作ったにて会社の人の反応観察中	0
記事書いてみたかったので、  に登録した	0
日目に参加しました	0
日目に参加しました	0
分かりやすい	0
ふわっと理解していた主成分分析をちゃんと理解できた気がする	0
あ、といっても   ではなくて、  の方でして…	0
「決定木やランダムフォレストは、特徴量のスケーリングに配慮する必要のない、数少ない機械学習アルゴリズムである」なるほど。	0
導入したいやーこの未来感ね	0
、とりあえず名前かっこいい	0
ん落ちてる	0
普段ユーザーだけど、たまに触ると楽しい	0
鳥貴族の優待届いたありがたしありがたし	0
スピードワゴンのお二人のツイートを決定木とランダムフォレストで分類してみました。良かったら読んでみてくださいー	0
せっかくのハロウィンなので、アキラのコスプレの上からパンツとズボン、そしてシャツにパーカーを着て家を出てみました。	0
ランダムフォレストのパラメータチューニングがなかなか終わらないので、その間について調べている	0
【】決定木とランダムフォレストの実践編記事あげました。	0
復活	0
年の枠があと万円ぐらい残ってるがどうしようかできれば使いきりたい	0
最近仕事忙しくて記事更新できていないが、来週あたりには更新します…たぶん。	0
この間書いた、タイムライン情報をと で可視化するという記事。実践してくれた人を発見してとても嬉しい…。	0
いい天気	0
前回のデータを使った 記事が好評だったので、でもやってみました。ユーザーの過去ツイートではなく、そのユーザーのタイムラインどんなツイートが表示されているかを可視化してみました。	0
最近ブクマがよくついてとても嬉しい	0
【でテキストマイニング】スピードワゴンの小沢さんのツイートを、 を使って可視化をしてみました小沢さんらしい言葉を見つけることができました。	0
関数とかその類を、最近苦なく使えるようになってきて感動している	0
文回使ったら人工知能	0
リツイートの効果とはてブ新着人気に載った効果が切れて、今日はアクセスが落ち着いている寂しい…	0
のことでググってたらこのページに辿り着いたんだけど、メッセージの和訳が「私メリー」的で怖すぎた思わず誰もいないはずのオフィスで後ろ振り返ったわ	0
からの応答時間が長すぎます。	0
買います	0
でテキストマイニングとかしたい人向けにで を使うための基礎講座です	0
を使用するための登録作業とかしていた色々テキストマイニングしてみよう	0
気付いたらフォロワーだ…アカウント作ってからカ月でやっと……	0
バギングとランダムフォレストについて、学校のクラスを例に説明してみました。次回実践編では、決定木、バギング、ランダムフォレストの精度比較をしてみたいと思いますのでご期待くださいませ	0
データ回したかったが、飲みながらやろう	0
体が熱燗を求めている本当か僕の体よこの暑い夜に本当に熱燗を飲みたいのかね	0
アナリティクスで、からセグメントを作ることってできないのかなー…軽く調べる限り情報出てこないアクセス解析自動化してくれるよりも、色々使い勝手良いセグメントを自動で作ってくれたほうがありがたいかもね	0
アドセンス開くと、「『デリケートなカテゴリの広告の許可』をすると収益上がる」って出てくるけど、許可していいものか…。パッと調べた感じそこまで有益な情報出てこないな	0
僕が君に教えたシャイニングウィザード君が僕に放ったシャイニングウィザード	0
帰るでしかし	0
何か選択に迷ったときは、リトル本田みたいに心の中にリトル〇〇を人作って、そいつらに「どうすればいい」って聞きまくって、人の答えの平均を出せば良い選択ができそうです。ランダムフォレストなどのブートストラップも一緒	0
環境の  のある記事の内容を本番環境のへタイトル・内容・メタディスクリプションなどそれぞれコピペしたいのだが良いの拡張機能ありますもしくはこれ参考にしたら作れるのでは的なのあります	0
前回の決定木の基礎に続いて「木の剪定」について考え方をました	0
しがないラジオを聴いている	0
というワーキングメモリー鍛えるゲームやってる本当に効果あるか分からんけどとりあえず面白い	0
社から今朝帰社社から今朝帰社社から今朝帰社早口言葉	0
決定木で最初に「うん」となりそうな不純度について「ウォーリーを探せ」に例えて説明してみましたきっと分かりやすい…はずです	0
「傾向スコア 」で検索順位位だーありがたいー	0
☓ 反教師あり学習○ 半教師あり学習なんか不良生徒感あるな	0
決定木についてています近日公開その後例のごとくとで何かしらのデータ使って実践記事書きますー	0
アドイン 選	0
最近よく空咳が出るなーと思って調べたらどうやらストレスが原因ぽい…あんまり意識してなかったけど思い返すとストレス溜まる生活してたることに気づくこういうサインを見逃さないことが大事っすね	0
のと星野源の を聴きながら週末が始まったので最高な気分です	0
上でを動かしたいのです	0
緑茶と熱燗が大好きなので涼しくなるのは大賛成ですお天道さんそういうことなんでよろしくっす	0
使えるとモテると聞いたのですが効果がありません。何をしたらモテますか	0
作ったアプリにあげてみたけどしばらくロードした後に    エラー出てしまうなログも良い情報残ってないしうーん…後でググってみよう	0
【 本ノック 】 アナリティクスからデータ取得見やすくグラフ化パワポダウンロードまで自動化するツールを作成しましたかなり便利ですとかもうちょい工夫したら、お金稼げるかもしれない…笑	0
使うのがスタンダードなのかなーとかでやっている人もいるのか	0
をサーバーにするの試してみる	0
ヶ月に一度ぐらいのペースで急に無性に聴きたくなって、試しに聴いてみたら良い曲すぎて回はリピートしてしまう曲ランキング第一位は僕の独断と偏見により、キリンジの「エイリアンズ」に決定しました	0
セブンの『和の逸品』っていうビール初めて飲んだけど、旨すぎない	0
あー触りたい触りたいよーーあー残業残業残業残業	0
第三弾使った可視化とパワポに落とす部分を今回実装してみました はてなブログ【本ノック 】グラフをインタラクティブに作……	0
楽しそう	0
会社のゼミで、シンプルな局所探索から発展させての話をした色々な初期値から更新の様子をプロットしつつシミュレーションしたので反応は良かった…と思うハアハアするほどは興奮してなかったけど笑	0
のデータが取得できるまでの期間がかなり空いてきてるなー前は日遅くて日だったのに月中旬のアップデートが原因かな	0
を使いこなす力がやはりまだ全然足りない	0
ヶ月前に寝違えた首がまだかすかに痛い	0
前回はでアナリティクスのデータを取得して表出力するツールを作りました 今回は可視化編ですつまりは「偽  」を作ります	0
でパワポ作ってダウンロードとかできるのか知らなかったまだちゃんと読んでないけど…やってみたすぎるんだが	0
に関するつぶやきをしている人をフォローしたいのだが、どうやって検索するのがいいんだろう「」だけだと当然関係ないツイート多いし「 」でもまだダメだし、細かすぎてもちょっとしか拾えないし…	0
の提供するサービスが有能すぎて何か悔しいので、いま話題の   みたいなツール本物にはほど遠いけどをで作ってやった午後に記事更新します	0
赤ちゃんと僕読んで号泣していた	0
記事立て込んでて書けてないな…土日に書き溜めて来週本更新します	0
タグマネージャに詳しくなる日々上に出てくる情報見てる感じだとちゃんと使いこなせている人って結構少なそうだ	0
実家帰省中だが、急遽オンライン打ち合わせ入った便利な時代だ･･･	0
やっぱり記事より記事の方が跳ねるなー	0
前回こちらで書いたでの傾向スコア実践編の記事をバージョンで書きましたぜひこちらも読んでみてくださいー	0
傾向スコアの実践編【編】の記事を公開しました編も早ければ明日、遅くとも来週火曜日あたりに公開します	0
カイロ行ってきて体スッキリ寝違えたのがわりと良くなったぞ	0
調べたら非推奨か、まあそうだよね	0
はてなブログってデフォルトで、 タグマネ仕込んでんのねそれ元にはてなブログの管理画面のアクセス解析出してんのか最近自分アカウントのタグマネ入れたらうまく計測できなくなったのは、バッティングしていたのかな	0
読了率取得するために書いたコードがいけない気がしてきた一旦削除して様子見	0
ちなみにはてなには タグマネいれて、 アナリティクスとアドセンスを管理している	0
はてなブログのデフォルトでついているアクセス解析数と アナリティクスでみる結果が違うのは何だろう基本はてなの方が多くて、たまに倍くらい違うときある	0
前回書いた記事、コードの説明皆無すぎて申し訳ないレベルだったので追記しました	0
自分もトレンドに乗っかって写真撮ってみる本当にでかい、緑本が新書ぐらいに見える笑犬匹本	0
昨日の関連のツイートに歴代ダントツのエンゲージメント頂いた初の桁リツイート、皆様ありがとうございます	0
審査通ったからとりあえず入れてみたけど、ヘッダー・フッター・サイドバー以外に記事中にも出てきちゃうのかそれはちょっと嫌だな	0
の記事を本書く予定ですちょい説明が不足しているかもですが…	0
月中に 犬匹本 を読まないとな	0
スマホのアプリが鬼のように落ちるな	0
これからの記事本ぐらい書くつもりだから、どなかた書籍化させてくれません	0
犬四匹本買わないと	0
傾向スコア実践した結果を記事にしてみようと思っているけど、データ選ぶのが難しいな…	0
楽しそう笑	0
傾向スコアについて、直感的な理解ができるような記事を書いてみました前編・後編に分かれています【傾向スコア前編】【傾向スコア後編】	0
パッケージ使ってみよう	0
初参加 ユーザーの優しさを感じている……懇親会参加希望したけど、軽い熱中症みたいな症状出てちょっと迷っている…	0
傾向スコアについて書いていたのですが、長くなりそうだったのでとりあえず前編のみ先に公開することにしましたよろしければお読みください…後編はまた月曜日あたりに公開します	0
あ、そういえばブログ、色々楽しそうなんで独自ドメインにしてみましたアクセスやっぱ減るのかなー	0
傾向スコアって良い名前だよねふと思ったけど	0
仕事でと格闘して日溶かしたあーああーあだよ	0
記事の流入数とか見てるとよりもの情報の方が需要あるんだなって感じまあまだ記事が少ないので誤差の範囲かもしれないが…【実践 編】【実践 編】	0
で使えるの知らなかった…これは使わないと	0
はてなブログに投稿しました はてなブログ都議選当選への影響要因をロジスティック回帰で推定【で実践編】  これで無理なら諦めて世界一やさしいデータ分析教室	0
昨日公開した、での都議選データを使ったロジスティック回帰の版を今書いています	0
ロジスティック回帰の流れで傾向スコアマッチングの記事書くか	0
基礎編【二項分布】【ポアソン分布】【理論編】【実践編】	0
はてなブログに投稿しました はてなブログ都民ファーストがやっぱり最強か 都議選のデータを使って、でロジスティック回帰してみた  これで無理なら諦めて世界一やさ……	0
ゼミ用に で書いた文章をはてなに移行している数式部分とかテーブルとか絶妙に修正が必要だな	0
都議選の当選結果から何が当選に影響を与えたかロジットしようとしたけどスクレイピングしづらいサイトばっかだしやっとの思いで取得して分析できたと思ったら全くいい感じの結果出ないの辛すぎるんだが	0
ユーザーって日本にどれくらいいるんだろう	0
イヤホン忘れたので急遽円ショップで買ったら両方だった仕方ないので無理やり左耳に両方入れて星野源聴いてる	0
